الشاعر,البحر,الشطر الأيمن,الشطر الأيسر,البيت
الإمام القحطاني الأندلسي,الكامل,وَأُولُو النُّبُوَّةِ وَالْهُدَى مَا مِنْهُمُ , أَحَدٌ يَهُودِيٌّ وَلاَ نَصْرَانِي,وَأُولُو النُّبُوَّةِ وَالْهُدَى مَا مِنْهُمُ أَحَدٌ يَهُودِيٌّ وَلاَ نَصْرَانِي
الإمام القحطاني الأندلسي,الكامل,بَلْ مُسْلِمُونَ وَمُؤْمِنُونَ بِرَبِّهْمِ , حُنَفَاءُ في الإِسْرَارِ وَالإِعْلاَنِ,بَلْ مُسْلِمُونَ وَمُؤْمِنُونَ بِرَبِّهْمِ حُنَفَاءُ في الإِسْرَارِ وَالإِعْلاَنِ
الإمام القحطاني الأندلسي,الكامل,وَلِمِلَّةِ الإِسْلاَمِ خَمْسُ عَقَائِدٍ , وَاللهُ أَنْطَقَنِي بِهَا وَهَدَانِي,وَلِمِلَّةِ الإِسْلاَمِ خَمْسُ عَقَائِدٍ وَاللهُ أَنْطَقَنِي بِهَا وَهَدَانِي
الإمام القحطاني الأندلسي,الكامل,لاَ تَعْصِ رَبَّكَ قَائِلاً أَوْ فَاعِلاً , فَكِلاَهُمَا في الصُّحْفِ مَكْتُوبَانِ,لاَ تَعْصِ رَبَّكَ قَائِلاً أَوْ فَاعِلاً فَكِلاَهُمَا في الصُّحْفِ مَكْتُوبَانِ
الإمام القحطاني الأندلسي,الكامل,جَمِّلْ زَمَانَكَ بِالسُّكُوتِ فَإِنَّهُ , زَيْنُ الْحَلِيمِ وَسُتْرَةُ الْحَيْرَانِ ,جَمِّلْ زَمَانَكَ بِالسُّكُوتِ فَإِنَّهُ زَيْنُ الْحَلِيمِ وَسُتْرَةُ الْحَيْرَانِ 
الإمام القحطاني الأندلسي,الكامل,كُنْ حِلْسَ بَيْتِكَ إِنْ سَمِعْتَ بِفِتْنَةٍ , وَتَوَقَّ كُلَّ مُنَافِقٍ فَتَّانِ,كُنْ حِلْسَ بَيْتِكَ إِنْ سَمِعْتَ بِفِتْنَةٍ وَتَوَقَّ كُلَّ مُنَافِقٍ فَتَّانِ
الإمام القحطاني الأندلسي,الكامل,أَدِّ الْفَرَائِضَ لاَ تَكُنْ مُتَوَانِيًا , فَتَكُونَ عِنْدَ اللهِ شَرَّ مُهَانِ,أَدِّ الْفَرَائِضَ لاَ تَكُنْ مُتَوَانِيًا فَتَكُونَ عِنْدَ اللهِ شَرَّ مُهَانِ
الإمام القحطاني الأندلسي,الكامل,أَدِمِ السِّوَاكَ مَعَ الْوُضُوءِ فَإِنَّهُ , مُرْضِي الإِلَهِ مُطَهِّرُ الأَسْنَانِ,أَدِمِ السِّوَاكَ مَعَ الْوُضُوءِ فَإِنَّهُ مُرْضِي الإِلَهِ مُطَهِّرُ الأَسْنَانِ
الإمام القحطاني الأندلسي,الكامل,سَمِّ الإِلَهَ لَدَى الْوُضُوءِ بِنِيَّةٍ , ثُمَّ اسْتَعِذْ مِنْ فِتْنَةِ الْوَلْهَانِ,سَمِّ الإِلَهَ لَدَى الْوُضُوءِ بِنِيَّةٍ ثُمَّ اسْتَعِذْ مِنْ فِتْنَةِ الْوَلْهَانِ
الإمام القحطاني الأندلسي,الكامل,فَأَسَاسُ أَعْمَالِ الْوَرَى نِيَّاتُهُمْ , وَعَلَى الأَسَاسِ قَوَاعِدُ الْبُنْيَانِ,فَأَسَاسُ أَعْمَالِ الْوَرَى نِيَّاتُهُمْ وَعَلَى الأَسَاسِ قَوَاعِدُ الْبُنْيَانِ
الإمام القحطاني الأندلسي,الكامل,أَسْبِغْ وُضُوءَكَ لاَ تُفَرِّقْ شَمْلَهُ , فَالْفَوْرُ وَالإِسْبَاغُ مُفْتَرَضَانِ,أَسْبِغْ وُضُوءَكَ لاَ تُفَرِّقْ شَمْلَهُ فَالْفَوْرُ وَالإِسْبَاغُ مُفْتَرَضَانِ
الإمام القحطاني الأندلسي,الكامل,فَإِذَا انْتَشَقْتَ فَلاَ تُبَالِغْ جَيِّدًا , لَكِنَّهُ شَمٌّ بِلاَ إِمْعَانِ,فَإِذَا انْتَشَقْتَ فَلاَ تُبَالِغْ جَيِّدًا لَكِنَّهُ شَمٌّ بِلاَ إِمْعَانِ
الإمام القحطاني الأندلسي,الكامل,وَعَلَيْكَ فَرْضًا غَسْلُ وَجْهِكَ كُلِّهِ , وَالْمَاءُ مُتَّبِعٌ بِهِ الْجَفْنَانِ,وَعَلَيْكَ فَرْضًا غَسْلُ وَجْهِكَ كُلِّهِ وَالْمَاءُ مُتَّبِعٌ بِهِ الْجَفْنَانِ
الإمام القحطاني الأندلسي,الكامل,وَاغْسِلْ يَدَيْكَ إِلَى الْمَرَافِقِ مُسْبِغًا , فَكِلاَهُمَا في الْغَسْلِ مَدْخُولاَنِ,وَاغْسِلْ يَدَيْكَ إِلَى الْمَرَافِقِ مُسْبِغًا فَكِلاَهُمَا في الْغَسْلِ مَدْخُولاَنِ
الإمام القحطاني الأندلسي,الكامل,وَامْسَحْ بِرَأْسِكَ كُلِّهِ مُسْتَوْفِيًا , وَالْمَاءُ مَمْسُوحٌ بِهِ الأُذُنَانِ,وَامْسَحْ بِرَأْسِكَ كُلِّهِ مُسْتَوْفِيًا وَالْمَاءُ مَمْسُوحٌ بِهِ الأُذُنَانِ
الإمام القحطاني الأندلسي,الكامل,وَكَذَا التَّمَضْمُضُ في وُضُوئِكَ سُنَّةٌ , بِالْمَاءِ ثُمَّ تَمُجُّهُ الشَّفَتَانِ,وَكَذَا التَّمَضْمُضُ في وُضُوئِكَ سُنَّةٌ بِالْمَاءِ ثُمَّ تَمُجُّهُ الشَّفَتَانِ
الإمام القحطاني الأندلسي,الكامل,وَالْوَجْهُ وَالْكَفَّانِ غَسْلُ كِلَيْهِمَا , فَرْضٌ وَيَدْخُلُ فِيهِمَا الْعَظْمَانِ,وَالْوَجْهُ وَالْكَفَّانِ غَسْلُ كِلَيْهِمَا فَرْضٌ وَيَدْخُلُ فِيهِمَا الْعَظْمَانِ
الإمام القحطاني الأندلسي,الكامل,غَسْلُ الْيَدَيْنِ لَدَى الْوُضُوءِ نَظَافَةٌ , أَمَرَ النَّبِيُّ بِهَا عَلَى اسْتِحْسَانِ,غَسْلُ الْيَدَيْنِ لَدَى الْوُضُوءِ نَظَافَةٌ أَمَرَ النَّبِيُّ بِهَا عَلَى اسْتِحْسَانِ
الإمام القحطاني الأندلسي,الكامل,سِيمَا إِذَا مَا قُمْتَ في غَسَقِ الدُّجَى , وَاسْتَيْقَظَتْ مِنْ نَوْمِكَ الْعَيْنَانِ,سِيمَا إِذَا مَا قُمْتَ في غَسَقِ الدُّجَى وَاسْتَيْقَظَتْ مِنْ نَوْمِكَ الْعَيْنَانِ
الإمام القحطاني الأندلسي,الكامل,وَكَذَلِكَ الرِّجْلاَنِ غَسْلُهُمَا مَعًا , فَرْضٌ وَيَدْخُلُ فِيهِمَا الْكَعْبَانِ,وَكَذَلِكَ الرِّجْلاَنِ غَسْلُهُمَا مَعًا فَرْضٌ وَيَدْخُلُ فِيهِمَا الْكَعْبَانِ
الإمام القحطاني الأندلسي,الكامل,لاَ تَسْتَمِعْ قَوْلَ الرَّوَافِضِ إِنَّهُمْ , مِنْ رَأْيِهِمْ أَنْ تُمْسَحَ الرِّجْلاَنِ,لاَ تَسْتَمِعْ قَوْلَ الرَّوَافِضِ إِنَّهُمْ مِنْ رَأْيِهِمْ أَنْ تُمْسَحَ الرِّجْلاَنِ
الإمام القحطاني الأندلسي,الكامل,يَتَأَوَّلُونَ قِرَاءَةً مَنْسُوخَةً , بِقِرَاءَةٍ وَهُمَا مُنَزَّلَتَانِ,يَتَأَوَّلُونَ قِرَاءَةً مَنْسُوخَةً بِقِرَاءَةٍ وَهُمَا مُنَزَّلَتَانِ
الإمام القحطاني الأندلسي,الكامل,إِحْدَاهُمَا نَزَلَتْ لِتَنْسَخَ أُخْتَهَا , لَكِنْ هُمَا في الصُّحْفِ مُثْبَتَتَانِ,إِحْدَاهُمَا نَزَلَتْ لِتَنْسَخَ أُخْتَهَا لَكِنْ هُمَا في الصُّحْفِ مُثْبَتَتَانِ
الإمام القحطاني الأندلسي,الكامل,غَسَلَ النَّبِيُّ وَصَحْبُهُ أَقْدَامَهُمْ , لَمْ يَخْتَلِفْ في غَسْلِهِمْ رَجُلاَنِ,غَسَلَ النَّبِيُّ وَصَحْبُهُ أَقْدَامَهُمْ لَمْ يَخْتَلِفْ في غَسْلِهِمْ رَجُلاَنِ
الإمام القحطاني الأندلسي,الكامل,وَالسُّنَّةُ الْبَيْضَاءُ عِنْدَ أُوْلِي النُّهَى , في الْحُكْمِ قَاضِيَةٌ عَلَى الْقُرْآنِ,وَالسُّنَّةُ الْبَيْضَاءُ عِنْدَ أُوْلِي النُّهَى في الْحُكْمِ قَاضِيَةٌ عَلَى الْقُرْآنِ
الإمام القحطاني الأندلسي,الكامل,فَإِذَا اسْتَوَتْ رِجْلاَكَ في خُفَّيْهِمَا , وَهُمَا مِنَ الأَحْدَاثِ طَاهِرَتَانِ,فَإِذَا اسْتَوَتْ رِجْلاَكَ في خُفَّيْهِمَا وَهُمَا مِنَ الأَحْدَاثِ طَاهِرَتَانِ
الإمام القحطاني الأندلسي,الكامل,وَأَرَدتَّ تَجْدِيدَ الطَّهَارَةِ مُحْدِثًا , فَتَمَامُهَا أَنْ يُمْسَحَ الْخُفَّانِ,وَأَرَدتَّ تَجْدِيدَ الطَّهَارَةِ مُحْدِثًا فَتَمَامُهَا أَنْ يُمْسَحَ الْخُفَّانِ
الإمام القحطاني الأندلسي,الكامل,وَإِذَا أَرَدتَّ طَهَارَةً لِجَنَابَةٍ , فَلْتُخْلَعَا وَلْتُغْسَلِ الْقَدَمَانِ,وَإِذَا أَرَدتَّ طَهَارَةً لِجَنَابَةٍ فَلْتُخْلَعَا وَلْتُغْسَلِ الْقَدَمَانِ
الإمام القحطاني الأندلسي,الكامل,غُسْلُ الْجَنَابَةِ في الرِّقَابِ أَمَانَةٌ , فَأَدَاؤُهَا مِنْ أَكْمَلِ الإِيمَانِ,غُسْلُ الْجَنَابَةِ في الرِّقَابِ أَمَانَةٌ فَأَدَاؤُهَا مِنْ أَكْمَلِ الإِيمَانِ
الإمام القحطاني الأندلسي,الكامل,فَإِذَا ابْتُلِيتَ فَبَادِرَنَّ بِغُسْلِهَا , لاَ خَيْرَ في مُتَثَبِّطٍ كَسْلاَنِ,فَإِذَا ابْتُلِيتَ فَبَادِرَنَّ بِغُسْلِهَا لاَ خَيْرَ في مُتَثَبِّطٍ كَسْلاَنِ
الإمام القحطاني الأندلسي,الكامل,وَإِذَا اغْتَسَلْتَ فَكُنْ لِجِسْمِكَ دَالِكًا , حَتَّى يَعُمَّ جَمِيعَهُ الْكَفَّانِ,وَإِذَا اغْتَسَلْتَ فَكُنْ لِجِسْمِكَ دَالِكًا حَتَّى يَعُمَّ جَمِيعَهُ الْكَفَّانِ
الإمام القحطاني الأندلسي,الكامل,وَإِذَا عَدِمْتَ الْمَاءَ كُنْ مُتَيَمِّمًا , مِنْ طِيبِ تُرْبِ الأَرْضِ وَالْجُدْرَانِ,وَإِذَا عَدِمْتَ الْمَاءَ كُنْ مُتَيَمِّمًا مِنْ طِيبِ تُرْبِ الأَرْضِ وَالْجُدْرَانِ
الإمام القحطاني الأندلسي,الكامل,مُتَيَمِّمًا صَلَّيْتَ أَوْ مُتَوَضِّئًا , فَكِلاَهُمَا في الشَّرْعِ مُجْزِيَتَانِ,مُتَيَمِّمًا صَلَّيْتَ أَوْ مُتَوَضِّئًا فَكِلاَهُمَا في الشَّرْعِ مُجْزِيَتَانِ
الإمام القحطاني الأندلسي,الكامل,وَالْغُسْلُ فَرْضٌ وَالتَّدَلُّكُ سُنَّةٌ , وَهُمَا بِمَذْهَبِ مَالِكٍ فَرْضَانِ,وَالْغُسْلُ فَرْضٌ وَالتَّدَلُّكُ سُنَّةٌ وَهُمَا بِمَذْهَبِ مَالِكٍ فَرْضَانِ
الإمام القحطاني الأندلسي,الكامل,وَالْمَاءُ مَا لَمْ تَسْتَحِلْ أَوْصَافُهُ , بِنَجَاسَةٍ أَوْ سَائِرِ الأَدْهَانِ,وَالْمَاءُ مَا لَمْ تَسْتَحِلْ أَوْصَافُهُ بِنَجَاسَةٍ أَوْ سَائِرِ الأَدْهَانِ
الإمام القحطاني الأندلسي,الكامل,فَإِذَا صَفَى في لَوْنِهِ أَوْ طَعْمِهِ , مَعَ رِيحِهِ مِنْ جُمْلَةِ الأَضْغَانِ,فَإِذَا صَفَى في لَوْنِهِ أَوْ طَعْمِهِ مَعَ رِيحِهِ مِنْ جُمْلَةِ الأَضْغَانِ
الإمام القحطاني الأندلسي,الكامل,فَهُنَاكَ سُمِّيَ طَاهِرًا وَمُطَهِّرًا , هَذَانِ أَبْلَغُ وَصْفِهِ هَذَانِ,فَهُنَاكَ سُمِّيَ طَاهِرًا وَمُطَهِّرًا هَذَانِ أَبْلَغُ وَصْفِهِ هَذَانِ
الإمام القحطاني الأندلسي,الكامل,فَإِذَا تَغَيَّرَ لَوْنُهُ أَوْ طَعْمُهُ , مِنْ حَمْأَةِ الآبَارِ وَالْغُدْرَانِ,فَإِذَا تَغَيَّرَ لَوْنُهُ أَوْ طَعْمُهُ مِنْ حَمْأَةِ الآبَارِ وَالْغُدْرَانِ
الإمام القحطاني الأندلسي,الكامل,جَازَ الْوُضُوءُ لَنَا بِهِ وَطُهُورُنَا , فَاسْمَعْ بِقَلْبٍ حَاضِرٍ يَقْظَانِ,جَازَ الْوُضُوءُ لَنَا بِهِ وَطُهُورُنَا فَاسْمَعْ بِقَلْبٍ حَاضِرٍ يَقْظَانِ
الإمام القحطاني الأندلسي,الكامل,وَمَتَى تَمُتْ في الْمَاءِ نَفْسٌ لَمْ يَجُزْ , مِنْهُ الطُّهُورُ لِعِلَّةِ السَّيَلاَنِ,وَمَتَى تَمُتْ في الْمَاءِ نَفْسٌ لَمْ يَجُزْ مِنْهُ الطُّهُورُ لِعِلَّةِ السَّيَلاَنِ
الإمام القحطاني الأندلسي,الكامل,إِلاَّ إِذَا كَانَ الْغَدِيرُ مُرَجْرِجًا , غَدَقًا بِلاَ كَيْلٍ وَلاَ مِيزَانِ ,إِلاَّ إِذَا كَانَ الْغَدِيرُ مُرَجْرِجًا غَدَقًا بِلاَ كَيْلٍ وَلاَ مِيزَانِ 
الإمام القحطاني الأندلسي,الكامل,أَوْ كَانَتِ الْمَيْتَاتُ مِمَّا لَمْ تَسِلْ , وَالْمَا قَلِيلٌ طَابَ لِلْغُسْلاَنِ,أَوْ كَانَتِ الْمَيْتَاتُ مِمَّا لَمْ تَسِلْ وَالْمَا قَلِيلٌ طَابَ لِلْغُسْلاَنِ
الإمام القحطاني الأندلسي,الكامل,وَالْبَحْرُ أَجْمَعُهُ طَهُورٌ مَاؤُهُ , وَتَحِلُّ مَيْتَتُهُ مِنَ الْحِيتَانِ,وَالْبَحْرُ أَجْمَعُهُ طَهُورٌ مَاؤُهُ وَتَحِلُّ مَيْتَتُهُ مِنَ الْحِيتَانِ
الإمام القحطاني الأندلسي,الكامل,إِيَّاكَ نَفْسَكَ وَالْعَدُوَّ وَكَيْدَهُ , فَكِلاَهُمَا لأَذَاكَ مُبْتَدِيَانِ,إِيَّاكَ نَفْسَكَ وَالْعَدُوَّ وَكَيْدَهُ فَكِلاَهُمَا لأَذَاكَ مُبْتَدِيَانِ
الإمام القحطاني الأندلسي,الكامل,وَاحْذَرْ وُضُوءَكَ مُفْرِطًا وَمُفَرِّطًا , فَكِلاَهُمَا في الْعِلْمِ مَحْذُورَانِ,وَاحْذَرْ وُضُوءَكَ مُفْرِطًا وَمُفَرِّطًا فَكِلاَهُمَا في الْعِلْمِ مَحْذُورَانِ
الإمام القحطاني الأندلسي,الكامل,فَقَلِيلُ مَائِكَ في وُضُوءِكَ خَدْعَةٌ , لِتَعُودَ صِحَّتُهُ إِلَى الْبُطْلاَنِ,فَقَلِيلُ مَائِكَ في وُضُوءِكَ خَدْعَةٌ لِتَعُودَ صِحَّتُهُ إِلَى الْبُطْلاَنِ
الإمام القحطاني الأندلسي,الكامل,وَتَعُودَ مَغْسُولاَتُهُ مُمْسُوحَةً , فَاحْذَرْ غُرُورَ الْمَارِدِ الْخَوَّانِ,وَتَعُودَ مَغْسُولاَتُهُ مُمْسُوحَةً فَاحْذَرْ غُرُورَ الْمَارِدِ الْخَوَّانِ
الإمام القحطاني الأندلسي,الكامل,وَكَثِيرُ مَائِكَ في وُضُوئِكَ بِدْعَةٌ , يَدْعُو إِلَى الْوَسْوَاسِ وَالْهَمَلاَنِ,وَكَثِيرُ مَائِكَ في وُضُوئِكَ بِدْعَةٌ يَدْعُو إِلَى الْوَسْوَاسِ وَالْهَمَلاَنِ
الإمام القحطاني الأندلسي,الكامل,لاَ تُكْثِرَنَّ وَلاَ تُقَلِّلْ وَاقْتَصِدْ , فَالْقَصْدُ وَالتَّوْفِيقُ مُصْطَحِبَانِ,لاَ تُكْثِرَنَّ وَلاَ تُقَلِّلْ وَاقْتَصِدْ فَالْقَصْدُ وَالتَّوْفِيقُ مُصْطَحِبَانِ
الإمام القحطاني الأندلسي,الكامل,وَإِذَا اسْتَطَبْتَ فَفِي الْحَدِيثِ ثَلاَثَةٌ , لَمْ يُجْزِنَا حَجَرٌ وَلاَ حَجَرَانِ,وَإِذَا اسْتَطَبْتَ فَفِي الْحَدِيثِ ثَلاَثَةٌ لَمْ يُجْزِنَا حَجَرٌ وَلاَ حَجَرَانِ
الإمام القحطاني الأندلسي,الكامل,مِنْ أَجْلِ أَنَّ لِكُلِّ مَخْرَجِ غَائِطٍ , شَرَجًا تَضُمُّ عَلَيْهِ نَاحِيَتَانِ,مِنْ أَجْلِ أَنَّ لِكُلِّ مَخْرَجِ غَائِطٍ شَرَجًا تَضُمُّ عَلَيْهِ نَاحِيَتَانِ
الإمام القحطاني الأندلسي,الكامل,وَإِذَا الأَذَى قَدْ جَازَ مَوْضِعَ عَادَةٍ , لَمْ يُجْزِ إِلاَّ الْمَاءُ بِالإِمْعَانِ,وَإِذَا الأَذَى قَدْ جَازَ مَوْضِعَ عَادَةٍ لَمْ يُجْزِ إِلاَّ الْمَاءُ بِالإِمْعَانِ
الإمام القحطاني الأندلسي,الكامل,نَقْضُ الْوُضُوءِ بِقُبْلَةٍ أَوْ لَمْسَةٍ , أَوْ طُولِ نَوْمٍ أَوْ بِمَسِّ خِتَانِ,نَقْضُ الْوُضُوءِ بِقُبْلَةٍ أَوْ لَمْسَةٍ أَوْ طُولِ نَوْمٍ أَوْ بِمَسِّ خِتَانِ
الإمام القحطاني الأندلسي,الكامل,أَوْ بَوْلَةٍ أَوْ غَائِطٍ أَوْ نَوْمَةٍ , أَوْ نَفْخَةٍ في السِّرِّ وَالإِعْلاَنِ,أَوْ بَوْلَةٍ أَوْ غَائِطٍ أَوْ نَوْمَةٍ أَوْ نَفْخَةٍ في السِّرِّ وَالإِعْلاَنِ
الإمام القحطاني الأندلسي,الكامل,وَمِنَ الْمَذِيِّ أَوِ الْوَدِيِّ كِلَيْهِمَا , مِنْ حَيْثُ يَبْدُو الْبَوْلُ يَنْحَدِرَانِ,وَمِنَ الْمَذِيِّ أَوِ الْوَدِيِّ كِلَيْهِمَا مِنْ حَيْثُ يَبْدُو الْبَوْلُ يَنْحَدِرَانِ
الإمام القحطاني الأندلسي,الكامل,وَلَرُبَّمَا نَفَخَ الْخَبِيثُ بِمَكْرِهِ , حَتَّى يَضُمَّ لِنَفْخِهِ الْفَخِذَانِ,وَلَرُبَّمَا نَفَخَ الْخَبِيثُ بِمَكْرِهِ حَتَّى يَضُمَّ لِنَفْخِهِ الْفَخِذَانِ
الإمام القحطاني الأندلسي,الكامل,وَبَيَانُ ذَلِكَ صَوْتُهُ أَوْ رِيحُهُ , هَاتَانِ بَيِّنَتَانِ صَادِقَتَانِ,وَبَيَانُ ذَلِكَ صَوْتُهُ أَوْ رِيحُهُ هَاتَانِ بَيِّنَتَانِ صَادِقَتَانِ
الإمام القحطاني الأندلسي,الكامل,وَالْغُسْلُ فَرْضٌ مِنْ ثَلاَثَةِ أَوْجُهٍ , دَفْقِ الْمَنِيِّ وَحَيْضَةِ النِّسْوَانِ,وَالْغُسْلُ فَرْضٌ مِنْ ثَلاَثَةِ أَوْجُهٍ دَفْقِ الْمَنِيِّ وَحَيْضَةِ النِّسْوَانِ
الإمام القحطاني الأندلسي,الكامل,إِنْزَالِهِ في نَوْمَةٍ أَوْ يَقْظَةٍ , حَالاَنِ لِلتَّطْهِيرِ مُوجِبَتَانِ,إِنْزَالِهِ في نَوْمَةٍ أَوْ يَقْظَةٍ حَالاَنِ لِلتَّطْهِيرِ مُوجِبَتَانِ
الإمام القحطاني الأندلسي,الكامل,وَتَطَهُّرُ الزَّوْجَيْنِ فَرْضٌ وَاجِبٌ , عِنْدَ الْجِمَاعِ إِذَا الْتَقَى الْفَرْجَانِ,وَتَطَهُّرُ الزَّوْجَيْنِ فَرْضٌ وَاجِبٌ عِنْدَ الْجِمَاعِ إِذَا الْتَقَى الْفَرْجَانِ
الإمام القحطاني الأندلسي,الكامل,فَكِلاَهُمَا إِنْ أَنْزَلاَ أَوْ أَكْسَلاَ , فَهُمَا بِحُكْمِ الشَّرْعِ يَغْتَسِلاَنِ,فَكِلاَهُمَا إِنْ أَنْزَلاَ أَوْ أَكْسَلاَ فَهُمَا بِحُكْمِ الشَّرْعِ يَغْتَسِلاَنِ
الإمام القحطاني الأندلسي,الكامل,وَاغْسِلْ إِذَا أَمْذَيْتَ فَرْجَكَ كُلَّهُ , وَالأُنْثَيَانِ فَلَيْسَ يُفْتَرَضَانِ,وَاغْسِلْ إِذَا أَمْذَيْتَ فَرْجَكَ كُلَّهُ وَالأُنْثَيَانِ فَلَيْسَ يُفْتَرَضَانِ
الإمام القحطاني الأندلسي,الكامل,وَالْحَيْضُ وَالنُّفَسَاءُ أَصْلٌ وَاحِدٌ , عِنْدَ انْقِطَاعِ الدَّمِّ يَغْتَسِلاَنِ,وَالْحَيْضُ وَالنُّفَسَاءُ أَصْلٌ وَاحِدٌ عِنْدَ انْقِطَاعِ الدَّمِّ يَغْتَسِلاَنِ
الإمام القحطاني الأندلسي,الكامل,وَإِذَا أَعَادَتْ بَعْدَ شَهْرَيْنِ الدِّمَا , تِلْكَ اسْتِحَاضَةُ بَعْدَ ذِي الشَّهْرَانِ,وَإِذَا أَعَادَتْ بَعْدَ شَهْرَيْنِ الدِّمَا تِلْكَ اسْتِحَاضَةُ بَعْدَ ذِي الشَّهْرَانِ
الإمام القحطاني الأندلسي,الكامل,فَلْتَغْتَسِلْ لِصَلاَتِهَا وَصِيَامِهَا , وَالْمُسْتَحَاضَةُ دَهْرُهَا نِصْفَانِ ,فَلْتَغْتَسِلْ لِصَلاَتِهَا وَصِيَامِهَا وَالْمُسْتَحَاضَةُ دَهْرُهَا نِصْفَانِ 
الإمام القحطاني الأندلسي,الكامل,فَالنِّصْفُ تَتْرُكُ صَوْمَهَا وَصَلاَتَهَا , وَدَمُ الْمَحِيضِ وَغَيْرُهُ لَوْنَانِ,فَالنِّصْفُ تَتْرُكُ صَوْمَهَا وَصَلاَتَهَا وَدَمُ الْمَحِيضِ وَغَيْرُهُ لَوْنَانِ
الإمام القحطاني الأندلسي,الكامل,وَإِذَا صَفَا مِنْهَا وَأَشْرَقَ لَوْنُهُ , فَصَلاَتُهَا وَالصَّوْمُ مُفْتَرَضَانِ,وَإِذَا صَفَا مِنْهَا وَأَشْرَقَ لَوْنُهُ فَصَلاَتُهَا وَالصَّوْمُ مُفْتَرَضَانِ
الإمام القحطاني الأندلسي,الكامل,تَقْضِي الصِّيَامَ وَلاَ تُعِيدُ صَلاَتَهَا , إِنَّ الصَّلاَةَ تَعُودُ كُلَّ زَمَانِ,تَقْضِي الصِّيَامَ وَلاَ تُعِيدُ صَلاَتَهَا إِنَّ الصَّلاَةَ تَعُودُ كُلَّ زَمَانِ
الإمام القحطاني الأندلسي,الكامل,فَالشَّرْعُ وَالْقُرْآنُ قَدْ حَكَمَا بِهِ , بَيْنَ النِّسَاءِ فَلَيْسَ يُطَّرَحَانِ,فَالشَّرْعُ وَالْقُرْآنُ قَدْ حَكَمَا بِهِ بَيْنَ النِّسَاءِ فَلَيْسَ يُطَّرَحَانِ
