الشاعر,البحر,الشطر الأيمن,الشطر الأيسر,البيت
الإمام القحطاني الأندلسي,الكامل,وَكَذَاكَ عِدَّةُ مَنْ تُوُفِّيَ زَوْجُهَا , سَبْعُونَ يَوْمًا بَعْدَهَا شَهْرَانِ,وَكَذَاكَ عِدَّةُ مَنْ تُوُفِّيَ زَوْجُهَا سَبْعُونَ يَوْمًا بَعْدَهَا شَهْرَانِ
الإمام القحطاني الأندلسي,الكامل,عِدَدُ الْحَوَامِلِ مِنْ طَلاَقٍ أَوْ فَنَا , وَضْعُ الأَجِنَّةِ صَارِخًا أَوْ فَانِي,عِدَدُ الْحَوَامِلِ مِنْ طَلاَقٍ أَوْ فَنَا وَضْعُ الأَجِنَّةِ صَارِخًا أَوْ فَانِي
الإمام القحطاني الأندلسي,الكامل,وَكَذَاكَ حُكْمُ السِّقْطِ في إِسْقَاطِهِ , حُكْمُ التَّمَامِ كِلاَهُمَا وَضْعَانِ,وَكَذَاكَ حُكْمُ السِّقْطِ في إِسْقَاطِهِ حُكْمُ التَّمَامِ كِلاَهُمَا وَضْعَانِ
الإمام القحطاني الأندلسي,الكامل,مَنْ لَمْ تَحِضْ أَوْ مَنْ تَقَلَّصَ حَيْضُهَا , قَدْ صَحَّ في كِلْتَيْهِمَا الْعَدَدَانِ,مَنْ لَمْ تَحِضْ أَوْ مَنْ تَقَلَّصَ حَيْضُهَا قَدْ صَحَّ في كِلْتَيْهِمَا الْعَدَدَانِ
الإمام القحطاني الأندلسي,الكامل,كِلْتَاهُمَا تَبْقَى ثَلاَثَةَ أَشْهُرٍ , حُكْمَاهُمَا في النَّصِّ مُسْتَوِيَانِ,كِلْتَاهُمَا تَبْقَى ثَلاَثَةَ أَشْهُرٍ حُكْمَاهُمَا في النَّصِّ مُسْتَوِيَانِ
الإمام القحطاني الأندلسي,الكامل,عِدَدُ الْجَوَارِ مِنَ الطَّلاَقِ بِحَيْضَةٍ , وَمِنَ الْوَفَاةِ الْخَمْسُ وَالشَّهْرَانِ,عِدَدُ الْجَوَارِ مِنَ الطَّلاَقِ بِحَيْضَةٍ وَمِنَ الْوَفَاةِ الْخَمْسُ وَالشَّهْرَانِ
الإمام القحطاني الأندلسي,الكامل,فَبِطَلْقَتَيْنِ تَبِينُ مِنْ زَوْجٍ لَهَا , لاَ رَدَّ إِلاَّ بَعْدَ زَوْجٍ ثَانِي,فَبِطَلْقَتَيْنِ تَبِينُ مِنْ زَوْجٍ لَهَا لاَ رَدَّ إِلاَّ بَعْدَ زَوْجٍ ثَانِي
الإمام القحطاني الأندلسي,الكامل,وَكَذَا الْحَرَائِرُ فَالثَّلاَثُ تَبِينُهَا , فَيُحِلُّ تِلْكَ وَهَذِهِ زَوْجَانِ,وَكَذَا الْحَرَائِرُ فَالثَّلاَثُ تَبِينُهَا فَيُحِلُّ تِلْكَ وَهَذِهِ زَوْجَانِ
الإمام القحطاني الأندلسي,الكامل,فَلْتَنْكِحَا زَوْجَيْهِمَا عَنْ غِبْطَةٍ , وَرِضًا بِلاَ دَلْسٍ وَلاَ عِصْيَانِ,فَلْتَنْكِحَا زَوْجَيْهِمَا عَنْ غِبْطَةٍ وَرِضًا بِلاَ دَلْسٍ وَلاَ عِصْيَانِ
الإمام القحطاني الأندلسي,الكامل,حَتَّى إِذَا امْتَزَجَ النِّكَاحُ بِدَلْسَةٍ , فَهُمَا مَعَ الزَّوْجَيْنِ زَانِيَتَانِ,حَتَّى إِذَا امْتَزَجَ النِّكَاحُ بِدَلْسَةٍ فَهُمَا مَعَ الزَّوْجَيْنِ زَانِيَتَانِ
الإمام القحطاني الأندلسي,الكامل,إِيَّاكَ وَالتَّيْسَ الْمُحَلِّلَ إِنَّهُ , وَالْمُسْتَحِلُّ لِرَدِّهَا تَيْسَانِ,إِيَّاكَ وَالتَّيْسَ الْمُحَلِّلَ إِنَّهُ وَالْمُسْتَحِلُّ لِرَدِّهَا تَيْسَانِ
الإمام القحطاني الأندلسي,الكامل,لَعَنَ النَّبِيُّ مُحِلِّلاً وَمُحَلَّلاً , فَكِلاَهُمَا في الشَّرْعِ مَلْعُونَانِ,لَعَنَ النَّبِيُّ مُحِلِّلاً وَمُحَلَّلاً فَكِلاَهُمَا في الشَّرْعِ مَلْعُونَانِ
الإمام القحطاني الأندلسي,الكامل,لاَ تَضْرِبَنْ أَمَةً وَلاَ عَبْدًا جَنَى , فَكِلاَهُمَا بِيَدَيْكَ مَأْسُورَانِ,لاَ تَضْرِبَنْ أَمَةً وَلاَ عَبْدًا جَنَى فَكِلاَهُمَا بِيَدَيْكَ مَأْسُورَانِ
الإمام القحطاني الأندلسي,الكامل,أَعْرِضْ عَنِ النِّسْوَانِ جُهْدَكَ وَانْتَدِبْ , لِعِنَاقِ خَيْرَاتٍ هُنَاكَ حِسَانِ,أَعْرِضْ عَنِ النِّسْوَانِ جُهْدَكَ وَانْتَدِبْ لِعِنَاقِ خَيْرَاتٍ هُنَاكَ حِسَانِ
الإمام القحطاني الأندلسي,الكامل,في جَنَّةٍ طَابَتْ وَطَابَ نَعِيمُهَا , مِنْ كُلِّ فَاكِهَةٍ بِهَا زَوْجَانِ,في جَنَّةٍ طَابَتْ وَطَابَ نَعِيمُهَا مِنْ كُلِّ فَاكِهَةٍ بِهَا زَوْجَانِ
الإمام القحطاني الأندلسي,الكامل,أَنْهَارُهَا تَجْرِي لَهُمْ مِنْ تَحْتِهِمْ , مَحْفُوفَةً بِالنَّخْلِ وَالرُّمَّانِ,أَنْهَارُهَا تَجْرِي لَهُمْ مِنْ تَحْتِهِمْ مَحْفُوفَةً بِالنَّخْلِ وَالرُّمَّانِ
الإمام القحطاني الأندلسي,الكامل,غُرُفَاتُهَا مِنْ لُؤْلُؤٍ وَزَبَرْجَدٍ , وَقُصُورُهَا مِنْ خَالِصِ الْعِقْيَانِ,غُرُفَاتُهَا مِنْ لُؤْلُؤٍ وَزَبَرْجَدٍ وَقُصُورُهَا مِنْ خَالِصِ الْعِقْيَانِ
الإمام القحطاني الأندلسي,الكامل,قُصِرَتْ بِهَا لِلْمُتَّقِينَ كَوَاعِبًا , شُبِّهْنَ بِالْيَاقُوتِ وَالْمَرْجَانِ,قُصِرَتْ بِهَا لِلْمُتَّقِينَ كَوَاعِبًا شُبِّهْنَ بِالْيَاقُوتِ وَالْمَرْجَانِ
الإمام القحطاني الأندلسي,الكامل,بِيضُ الْوُجُوهِ شُعُورُهُنَّ حَوَالِكٌ , حُمْرُ الْخُدُودِ عَوَاتِقُ الأَجْفَانِ,بِيضُ الْوُجُوهِ شُعُورُهُنَّ حَوَالِكٌ حُمْرُ الْخُدُودِ عَوَاتِقُ الأَجْفَانِ
الإمام القحطاني الأندلسي,الكامل,فُلْجُ الثُّغُورِ إِذَا ابْتَسَمْنَ ضَوَاحِكًا , هِيفُ الْخُصُورِ نَوَاعِمُ الأَبْدَانِ,فُلْجُ الثُّغُورِ إِذَا ابْتَسَمْنَ ضَوَاحِكًا هِيفُ الْخُصُورِ نَوَاعِمُ الأَبْدَانِ
الإمام القحطاني الأندلسي,الكامل,خُضْرُ الثِّيَابِ ثُدِيُّهُنَّ نَوَاهِدٌ , صُفْرُ الْحُلِيِّ عَوَاطِرُ الأَرْدَانِ,خُضْرُ الثِّيَابِ ثُدِيُّهُنَّ نَوَاهِدٌ صُفْرُ الْحُلِيِّ عَوَاطِرُ الأَرْدَانِ
الإمام القحطاني الأندلسي,الكامل,طُوبَى لِقَوْمٍ هُنَّ أَزْوَاجٌ لَهُمْ , في دَارِ عَدْنٍ في مَحَلِّ أَمَانِ,طُوبَى لِقَوْمٍ هُنَّ أَزْوَاجٌ لَهُمْ في دَارِ عَدْنٍ في مَحَلِّ أَمَانِ
الإمام القحطاني الأندلسي,الكامل,يُسْقَوْنَ مِنْ خَمْرٍ لَذِيذٍ شُرْبُهَا , بِأَنَامِلِ الْخُدَّامِ وَالْوِلْدَانِ,يُسْقَوْنَ مِنْ خَمْرٍ لَذِيذٍ شُرْبُهَا بِأَنَامِلِ الْخُدَّامِ وَالْوِلْدَانِ
الإمام القحطاني الأندلسي,الكامل,لَوْ تَنْظُرِ الْحَوْرَاءَ عِنْدَ وَلِيِّهَا , وَهُمَا فُوَيْقَ الْفُرْشِ مُتَّكِئَانِ,لَوْ تَنْظُرِ الْحَوْرَاءَ عِنْدَ وَلِيِّهَا وَهُمَا فُوَيْقَ الْفُرْشِ مُتَّكِئَانِ
الإمام القحطاني الأندلسي,الكامل,يَتَنَازَعَانِ الْكَأْسَ في أَيْدِيهِمَا , وَهُمَا بِلَذَّةِ شُرْبِهَا فَرِحَانِ,يَتَنَازَعَانِ الْكَأْسَ في أَيْدِيهِمَا وَهُمَا بِلَذَّةِ شُرْبِهَا فَرِحَانِ
الإمام القحطاني الأندلسي,الكامل,وَلَرُبَّمَا تَسْقِيهِ كَأْسًا ثَانِيًا , وَكِلاَهُمَا بِرُضَابِهَا حُلْوَانِ,وَلَرُبَّمَا تَسْقِيهِ كَأْسًا ثَانِيًا وَكِلاَهُمَا بِرُضَابِهَا حُلْوَانِ
الإمام القحطاني الأندلسي,الكامل,يَتَحَدَّثَانِ عَلَى الأَرَائِكِ خَلْوَةً , وَهُمَا بِثَوْبِ الْوَصْلِ مُشْتَمِلاَنِ,يَتَحَدَّثَانِ عَلَى الأَرَائِكِ خَلْوَةً وَهُمَا بِثَوْبِ الْوَصْلِ مُشْتَمِلاَنِ
الإمام القحطاني الأندلسي,الكامل,أَكْرِمْ بِجَنَّاتِ النَّعِيمِ وَأَهْلِهَا , إِخْوَانُ صِدْقٍ أَيُّمَا إِخْوَانِ,أَكْرِمْ بِجَنَّاتِ النَّعِيمِ وَأَهْلِهَا إِخْوَانُ صِدْقٍ أَيُّمَا إِخْوَانِ
الإمام القحطاني الأندلسي,الكامل,جِيرَانُ رَبِّ الْعَالَمِينَ وَحِزْبُهُ , أَكْرِمْ بِهِمْ في صَفْوَةِ الْجِيرَانِ,جِيرَانُ رَبِّ الْعَالَمِينَ وَحِزْبُهُ أَكْرِمْ بِهِمْ في صَفْوَةِ الْجِيرَانِ
الإمام القحطاني الأندلسي,الكامل,هُمْ يَسْمَعُونَ كَلاَمَهُ وَيَرَوْنَهُ , وَالْمُقْلَتَانِ إِلَيْهِ نَاظِرَتَانِ,هُمْ يَسْمَعُونَ كَلاَمَهُ وَيَرَوْنَهُ وَالْمُقْلَتَانِ إِلَيْهِ نَاظِرَتَانِ
الإمام القحطاني الأندلسي,الكامل,وَعَلَيْهِمُ فِيهِا مَلاَبِسُ سُنْدُسٍ , وَعَلَى الْمَفَارِقِ أَحْسَنُ التِّيجَانِ,وَعَلَيْهِمُ فِيهِا مَلاَبِسُ سُنْدُسٍ وَعَلَى الْمَفَارِقِ أَحْسَنُ التِّيجَانِ
الإمام القحطاني الأندلسي,الكامل,تِيجَانُهُمْ مِنْ لُؤْلُؤٍ وَزَبَرْجَدٍ , أَوْ فِضَّةٍ مِنْ خَالِصِ الْعِقْيَانِ,تِيجَانُهُمْ مِنْ لُؤْلُؤٍ وَزَبَرْجَدٍ أَوْ فِضَّةٍ مِنْ خَالِصِ الْعِقْيَانِ
الإمام القحطاني الأندلسي,الكامل,وَخَوَاتِمٌ مِنْ عَسْجَدٍ وَأَسَاوِرٌ , مِنْ فِضَّةٍ كُسِيَتْ بِهَا الزَّنْدَانِ,وَخَوَاتِمٌ مِنْ عَسْجَدٍ وَأَسَاوِرٌ مِنْ فِضَّةٍ كُسِيَتْ بِهَا الزَّنْدَانِ
الإمام القحطاني الأندلسي,الكامل,وَطَعَامُهُمْ مِنْ لَحْمِ طَيْرٍ نَاعِمٍ , كَالْبُخْتِ يُطْعَمُ سَائِرُ الأَلْوَانِ ,وَطَعَامُهُمْ مِنْ لَحْمِ طَيْرٍ نَاعِمٍ كَالْبُخْتِ يُطْعَمُ سَائِرُ الأَلْوَانِ 
الإمام القحطاني الأندلسي,الكامل,وَصِحَافُهُمْ ذَهَبٌ وَدُرٌّ فَائِقٌ , سَبْعُونَ أَلْفًا فَوْقَ أَلْفِ خِوَانِ,وَصِحَافُهُمْ ذَهَبٌ وَدُرٌّ فَائِقٌ سَبْعُونَ أَلْفًا فَوْقَ أَلْفِ خِوَانِ
الإمام القحطاني الأندلسي,الكامل,إِنْ كُنْتَ مُشْتَاقًا لَهَا كَلِفًا بِهَا , شَوْقَ الْغَرِيبِ لِرُؤْيَةِ الأَوْطَانِ,إِنْ كُنْتَ مُشْتَاقًا لَهَا كَلِفًا بِهَا شَوْقَ الْغَرِيبِ لِرُؤْيَةِ الأَوْطَانِ
الإمام القحطاني الأندلسي,الكامل,كُنْ مُحْسِنًا فِيمَا اسْتَطَعْتَ فَرُبَّمَا , تُجْزَى عَنِ الإِحْسَانِ بِالإِحْسَانِ,كُنْ مُحْسِنًا فِيمَا اسْتَطَعْتَ فَرُبَّمَا تُجْزَى عَنِ الإِحْسَانِ بِالإِحْسَانِ
الإمام القحطاني الأندلسي,الكامل,وَاعْمَلْ لِجَنَّاتِ النَّعِيمِ وَطِيبِهَا , فَنَعِيمُهَا يَبْقَى وَلَيْسَ بِفَانِ,وَاعْمَلْ لِجَنَّاتِ النَّعِيمِ وَطِيبِهَا فَنَعِيمُهَا يَبْقَى وَلَيْسَ بِفَانِ
الإمام القحطاني الأندلسي,الكامل,أَدِمِ الصِّيَامَ مَعَ الْقِيَامِ تَعَبُّدًا , فَكِلاَهُمَا عَمَلاَنِ مَقْبُولاَنِ,أَدِمِ الصِّيَامَ مَعَ الْقِيَامِ تَعَبُّدًا فَكِلاَهُمَا عَمَلاَنِ مَقْبُولاَنِ
الإمام القحطاني الأندلسي,الكامل,قُمْ في الدُّجَى وَاتْلُ الْكِتَابَ وَلاَ تَنَمْ , إِلاَّ كَنَوْمَةِ حَائِرٍ وَلْهَانِ,قُمْ في الدُّجَى وَاتْلُ الْكِتَابَ وَلاَ تَنَمْ إِلاَّ كَنَوْمَةِ حَائِرٍ وَلْهَانِ
الإمام القحطاني الأندلسي,الكامل,فَلَرُبَّمَا تَأْتِي الْمَنِيَّةُ بَغْتَةً , فَتُسَاقُ مِنْ فُرُشٍ إِلَى الأَكْفَانِ,فَلَرُبَّمَا تَأْتِي الْمَنِيَّةُ بَغْتَةً فَتُسَاقُ مِنْ فُرُشٍ إِلَى الأَكْفَانِ
الإمام القحطاني الأندلسي,الكامل,يَا حَبَّذَا عَيْنَانِ في غَسَقِ الدُّجَى , مِنْ خَشْيَةِ الرَّحْمَنِ بَاكِيَتَانِ,يَا حَبَّذَا عَيْنَانِ في غَسَقِ الدُّجَى مِنْ خَشْيَةِ الرَّحْمَنِ بَاكِيَتَانِ
الإمام القحطاني الأندلسي,الكامل,لاَ تَقْذِفَنَّ الْمُحْصَنَاتِ وَلاَ تَقُلْ , مَا لَيْسَ تَعْلَمُهُ مِنَ الْبُهْتَانِ,لاَ تَقْذِفَنَّ الْمُحْصَنَاتِ وَلاَ تَقُلْ مَا لَيْسَ تَعْلَمُهُ مِنَ الْبُهْتَانِ
الإمام القحطاني الأندلسي,الكامل,لاَ تَدْخُلَنَّ بُيُوتَ قَوْمٍ حُضَّرٍ , إِلاَّ بِنَحْنَحَةٍ أَوِ اسْتِئْذَانِ,لاَ تَدْخُلَنَّ بُيُوتَ قَوْمٍ حُضَّرٍ إِلاَّ بِنَحْنَحَةٍ أَوِ اسْتِئْذَانِ
الإمام القحطاني الأندلسي,الكامل,لاَ تَجْزَعَنَّ إِذَا دَهَتْكَ مُصِيبَةٌ , إِنَّ الصَّبُورَ ثَوَابُهُ ضِعْفَانِ,لاَ تَجْزَعَنَّ إِذَا دَهَتْكَ مُصِيبَةٌ إِنَّ الصَّبُورَ ثَوَابُهُ ضِعْفَانِ
الإمام القحطاني الأندلسي,الكامل,فَإِذَا ابْتُلِيتَ بِنَكْبَةٍ فَاصْبِرْ لَهَا , اللهُ حَسْبِي وَحْدَهُ وَكَفَانِي,فَإِذَا ابْتُلِيتَ بِنَكْبَةٍ فَاصْبِرْ لَهَا اللهُ حَسْبِي وَحْدَهُ وَكَفَانِي
الإمام القحطاني الأندلسي,الكامل,وَعَلَيْكَ بِالْفِقْهِ الْمُبَيِّنِ شَرْعَنَا , وَفَرَائِضِ الْمِيرَاثِ وَالْقُرْآنِ,وَعَلَيْكَ بِالْفِقْهِ الْمُبَيِّنِ شَرْعَنَا وَفَرَائِضِ الْمِيرَاثِ وَالْقُرْآنِ
الإمام القحطاني الأندلسي,الكامل,عِلْمُ الْحِسَابِ وَعِلْمُ شَرْعِ مُحَمَّدٍ , عِلْمَانِ مَطْلُوبَانِ مُتَّبَعَانِ,عِلْمُ الْحِسَابِ وَعِلْمُ شَرْعِ مُحَمَّدٍ عِلْمَانِ مَطْلُوبَانِ مُتَّبَعَانِ
الإمام القحطاني الأندلسي,الكامل,لَوْلاَ الْفَرَائِضُ ضَاعَ مِيرَاثُ الْوَرَى , وَجَرَى خِصَامُ الْوُلْدِ وَالشِّيبَانِ,لَوْلاَ الْفَرَائِضُ ضَاعَ مِيرَاثُ الْوَرَى وَجَرَى خِصَامُ الْوُلْدِ وَالشِّيبَانِ
الإمام القحطاني الأندلسي,الكامل,لَوْلاَ الْحِسَابُ وَضَرْبُهُ وَكُسُورُهُ , لَمْ يَنْقَسِمْ سَهْمٌ وَلاَ سَهْمَانِ,لَوْلاَ الْحِسَابُ وَضَرْبُهُ وَكُسُورُهُ لَمْ يَنْقَسِمْ سَهْمٌ وَلاَ سَهْمَانِ
الإمام القحطاني الأندلسي,الكامل,لاَ تَلْتَمِسْ عِلْمَ الْكَلاَمِ فَإِنَّهُ , يَدْعُو إِلَى التَّعْطِيلِ وَالْهَيَمَانِ,لاَ تَلْتَمِسْ عِلْمَ الْكَلاَمِ فَإِنَّهُ يَدْعُو إِلَى التَّعْطِيلِ وَالْهَيَمَانِ
الإمام القحطاني الأندلسي,الكامل,لاَ يَصْحَبُ الْبِدْعِيَّ إِلاَّ مِثْلُهُ , تَحْتَ الدُّخَانِ تَأَجُّجُ النِّيرَانِ,لاَ يَصْحَبُ الْبِدْعِيَّ إِلاَّ مِثْلُهُ تَحْتَ الدُّخَانِ تَأَجُّجُ النِّيرَانِ
الإمام القحطاني الأندلسي,الكامل,عِلْمُ الْكَلاَمِ وَعِلْمُ شَرْعِ مُحَمَّدٍ , يَتَغَايَرَانِ وَلَيَسْ يَشْتَبِهَانِ,عِلْمُ الْكَلاَمِ وَعِلْمُ شَرْعِ مُحَمَّدٍ يَتَغَايَرَانِ وَلَيَسْ يَشْتَبِهَانِ
الإمام القحطاني الأندلسي,الكامل,أَخَذُوا الْكَلاَمَ عَنِ الْفَلاَسِفَةِ الأُلَى , جَحَدُوا الشَّرَائِعَ غِرَّةً وَأَمَانِ,أَخَذُوا الْكَلاَمَ عَنِ الْفَلاَسِفَةِ الأُلَى جَحَدُوا الشَّرَائِعَ غِرَّةً وَأَمَانِ
الإمام القحطاني الأندلسي,الكامل,حَمَلُوا الأُمُورَ عَلَى قِيَاسِ عُقُولِهِمْ , فَتَبَلَّدُوا كَتَبَلُّدِ الْحَيْرَانِ,حَمَلُوا الأُمُورَ عَلَى قِيَاسِ عُقُولِهِمْ فَتَبَلَّدُوا كَتَبَلُّدِ الْحَيْرَانِ
الإمام القحطاني الأندلسي,الكامل,مُرْجِيُّهُمْ يُزْرِي عَلَى قَدَرِيِّهِمْ , وَالْفِرْقَتَانِ لَدَيَّ كَافِرَتَانِ,مُرْجِيُّهُمْ يُزْرِي عَلَى قَدَرِيِّهِمْ وَالْفِرْقَتَانِ لَدَيَّ كَافِرَتَانِ
الإمام القحطاني الأندلسي,الكامل,وَيَسَبُّ مُخَتَارِيُّهُمْ دَوْرِيَّهُمْ , وَالْقَرْمَطِيُّ مُلاَعِنُ الرُّفْضَانِ,وَيَسَبُّ مُخَتَارِيُّهُمْ دَوْرِيَّهُمْ وَالْقَرْمَطِيُّ مُلاَعِنُ الرُّفْضَانِ
الإمام القحطاني الأندلسي,الكامل,وَيَعِيبُ كَرَّامِيُّهُمْ وَهْبِيَّهُمْ , وَكِلاَهُمَا يَرْوِي عَنِ ابْنِ أَبَانِ ,وَيَعِيبُ كَرَّامِيُّهُمْ وَهْبِيَّهُمْ وَكِلاَهُمَا يَرْوِي عَنِ ابْنِ أَبَانِ 
الإمام القحطاني الأندلسي,الكامل,لِحِجَاجِهِمْ شُبَهٌ تُخَالُ وَرَوْنَقٌ , مِثْلُ السَّرَابِ يَلُوحُ لِلظَّمْآنِ,لِحِجَاجِهِمْ شُبَهٌ تُخَالُ وَرَوْنَقٌ مِثْلُ السَّرَابِ يَلُوحُ لِلظَّمْآنِ
الإمام القحطاني الأندلسي,الكامل,دَعْ أَشْعَرِيَّهُمُ وَمُعْتَزِلِيَّهُمْ , يَتَنَاقَرُونَ تَنَاقُرَ الْغِرْبَانِ,دَعْ أَشْعَرِيَّهُمُ وَمُعْتَزِلِيَّهُمْ يَتَنَاقَرُونَ تَنَاقُرَ الْغِرْبَانِ
الإمام القحطاني الأندلسي,الكامل,كُلٌّ يَقِيسُ بِعَقْلِهِ سُبُلَ الْهُدَى , وَيَتِيهُ تَيْهَ الْوَالِهِ الْهَيْمَانِ,كُلٌّ يَقِيسُ بِعَقْلِهِ سُبُلَ الْهُدَى وَيَتِيهُ تَيْهَ الْوَالِهِ الْهَيْمَانِ
الإمام القحطاني الأندلسي,الكامل,فَاللهُ يَجْزِيهِمْ بِمَا هُمْ أَهْلُهُ , وَلَهُ الثَّنَا مِنْ قَوْلِهِمْ بَرَّانِي,فَاللهُ يَجْزِيهِمْ بِمَا هُمْ أَهْلُهُ وَلَهُ الثَّنَا مِنْ قَوْلِهِمْ بَرَّانِي
الإمام القحطاني الأندلسي,الكامل,مَنْ قَاسَ شَرْعَ مُحَمَّدٍ في عَقْلِهِ , قَذَفَتْ بِهِ الأَهْوَاءُ في غَدْرَانِ,مَنْ قَاسَ شَرْعَ مُحَمَّدٍ في عَقْلِهِ قَذَفَتْ بِهِ الأَهْوَاءُ في غَدْرَانِ
الإمام القحطاني الأندلسي,الكامل,لاَ تَفْتَكِرْ في ذَاتِ رَبِّكَ وَاعْتَبِرْ , فِيمَا بِهِ يَتَصَرَّفُ الْمَلَوَانِ,لاَ تَفْتَكِرْ في ذَاتِ رَبِّكَ وَاعْتَبِرْ فِيمَا بِهِ يَتَصَرَّفُ الْمَلَوَانِ
الإمام القحطاني الأندلسي,الكامل,وَاللهُ رَبِّي مَا تُكَيَّفُ ذَاتُهُ , بِخَوَاطِرِ الأَوْهَامِ وَالأَذْهَانِ,وَاللهُ رَبِّي مَا تُكَيَّفُ ذَاتُهُ بِخَوَاطِرِ الأَوْهَامِ وَالأَذْهَانِ
الإمام القحطاني الأندلسي,الكامل,أَمْرِرْ أَحَادِيثَ الصِّفَاتِ كَمَا أَتَتْ , مِنْ غَيْرِ تَأْوِيلٍ وَلاَ هَذَيَانِ,أَمْرِرْ أَحَادِيثَ الصِّفَاتِ كَمَا أَتَتْ مِنْ غَيْرِ تَأْوِيلٍ وَلاَ هَذَيَانِ
الإمام القحطاني الأندلسي,الكامل,هُوَ مَذْهَبُ الزُّهْرِي وَوَافَقَ مَالِكٌ , وَكِلاَهُمَا في شَرْعِنَا عَلَمَانِ,هُوَ مَذْهَبُ الزُّهْرِي وَوَافَقَ مَالِكٌ وَكِلاَهُمَا في شَرْعِنَا عَلَمَانِ
الإمام القحطاني الأندلسي,الكامل,للهِ وَجْهٌ لاَ يُحَدُّ بِصُورَةٍ , وَلِرَبِّنَا عَيْنَانِ نَاظِرَتَانِ,للهِ وَجْهٌ لاَ يُحَدُّ بِصُورَةٍ وَلِرَبِّنَا عَيْنَانِ نَاظِرَتَانِ
الإمام القحطاني الأندلسي,الكامل,وَلَهُ يَدَانِ كَمَا يَقُولُ إِلَهُنَا , وَيَمِينُهُ جَلَّتْ عَنِ الأَيْمَانِ,وَلَهُ يَدَانِ كَمَا يَقُولُ إِلَهُنَا وَيَمِينُهُ جَلَّتْ عَنِ الأَيْمَانِ
الإمام القحطاني الأندلسي,الكامل,كِلْتَا يَدَيْ رَبِّي يَمِينٌ وَصْفُهَا , وَهُمَا عَلَى الثَّقَلَيْنِ مُنْفِقَتَانِ,كِلْتَا يَدَيْ رَبِّي يَمِينٌ وَصْفُهَا وَهُمَا عَلَى الثَّقَلَيْنِ مُنْفِقَتَانِ
