,Bayt_Text,Bahr
158,غَشيتُ مَنازِلنْ مِن آل هِندِنْ قِفارنْ بُدْدِلَت بَعدي عُفِيْيا,الوافر
159,تُبينُ رَمادَها وَمَخَطْطَ نُؤيِنْ وَأَشعَثَ ماثِلنْ فيها ثَوِيْيا,الوافر
160,فَكادَت مِن مَعارِفِها دُموعي تَهُمْمُ الشَأنَ ثُمْمَ ذَكَرتُ حَيْيا,الوافر
161,وَكانَ الجَهلُ لَو أَبكاكَ رَسمُنْ وَلَستُ أُحِبْبُ أَن أُدعى سَفِيْيا,الوافر
162,وَنَدمانِنْ كَريمِ الجَدْدِ سَمحِنْ صَبَحتُ بِسُحرَةتِنْ كَأسنْ سَبِيْيا,الوافر
163,يُحاذِرُ أَن تُباكِرَ عاذِلاتُنْ فَيُنبَأَ أَنْنَهُ أَضحى غَوِيْيا,الوافر
164,فَقالَ لَنا أَلا هَل مِن شِواءِنْ بِتَعريضِنْ وَلَم يَكميهِ عِيْيا,الوافر
165,فَأَرسَلتُ الغُلامَ وَلَم أُلَبْبِث إِلى خَيرِ البَوائِكِ تَوهَرِيْيا,الوافر
166,فَناءَت لِلقِيامِ لِغَيرِ سَوقِنْ وَأُتبِعُها جُرازنْ مُشرَفِيْيا,الوافر
167,فَظَلْلَ بِنِعمَةتِنْ يُسعى عَلَيهِ وَراحَ بِها كَريمنْ أَجفَلِيْيا,الوافر
168,وَكُنتُ إِذا الهُمومُ تَضَيْيَفَتني قَرَيتُ الهَمْمَ أَهوَجَ دَوسَرِيْيا,الوافر
169,بُوَيزِلَ عامِهِ مِردى قِذافِنْ عَلى التَأويبِ لا يَشكو الوَنِيْيا,الوافر
170,يُشيحُ عَلى الفَلاةِ فَيَعتَليها وَأَذرَعُ ما صَدَعتَ بِهِ المَطِيْيا,الوافر
171,كَأَني حينَ أَزجُرُهُ بِصَوتي زَجَرتُ بِهِ مُدِلْلنْ أَخدَرِيْيا,الوافر
172,تَمَهْهَلَ عانَتَنْ قَد ذَبْبَ عَنها يَكونَ مَصامُهُ مَنها قَصِيْيا,الوافر
173,أَطالَ الشَدْدَ وَالتَقريبَ حَتْتى ذَكَرتَ بِهِ مُمَرْرنْ أَندَرِيْيا,الوافر
174,بِها في رَوضَةتِنْ شَهرَي رَبيعِنْ فَسافَ لَها أَديمنْ أَدلَصِيْيا,الوافر
175,مُشيحنْ هَل يَرى شَبَحنْ قَريبنْ وَيوفي دونَها العَلَمَ العَلِيْيا,الوافر
176,إِذا لاقى بِظاهِرَةتِنْ دَحيقنْ أَمَرْرَ عَلَيهِما يَومنْ قَسِيْيا,الوافر
177,فَلَمْما قَلْلَصَت عَنهُ البَقايا وَأَعوَزَ مِن مَراتِعِهِ اللَوِيْيا,الوافر
178,أَرَنْنَ فَصَكْكَها صَخِبُنْ دَءولُنْ يَعُبْبُ عَلى مَناكِبِها الصَبِيْيا,الوافر
179,فَأَورَدَها عَلى طِملِنْ يَمانِنْ يُهِلْلُ إِذا رَأى لَحمنْ طَرِيْيا,الوافر
180,لَهُ شِريانَتُنْ شَغَلَت يَدَيهِ وَكانَ عَلى تَقَلْلُدِها قَوِيْيا,الوافر
181,وَزُرقُنْ قَد تَنَخْخَلَها لِقَضبِنْ يَشُدْدُ عَلى مَناصِبِها النَضِيْيا,الوافر
182,تَرَدْدى بُرأَتَنْ لَمْما بَناها تَبَوْوَأَ مَقعَدنْ مِنها خَفِيْيا,الوافر
183,فَلَمْما لَم يَرَينَ كَثيرَ ذُعرِنْ وَرَدنَ صَوادِينْ وَردنْ كَمِيْيا,الوافر
184,فَأَرسَلَ وَالمَقاتِلُ مُعوِراتُنْ لِما لاقَت ذُعافنْ يَثرِبِيْيا,الوافر
185,فَخَرْرَ النَصلُ مُنقَعِصنْ رَثيمنْ وَطارَ القِدحُ أَشتاتنْ شَظِيْيا,الوافر
186,وَعَضْضَ عَلى أَنامِلِهِ لَهيفنْ وَلاقى يَومَهُ أَسَفنْ وَغِيْيا,الوافر
187,وَراحَ بِحِرْرَةتِنْ لَهِفنْ مُصابنْ يُنَبْبِئُ عِرسَهُ أَمرنْ جَلِيْيا,الوافر
188,فَلَو لُطِمَت هُناكَ بَذاتِ خَمسِنْ لَكانا عِندَها حِتنَينِ سِيْيا,الوافر
189,وَكانوا واثِقينَ إِذا أَتاهُم بِلَحمِنْ إِن صَباحنْ أَو مُسِيْيا,الوافر
230,وَما عَيشُ الفَتى في الناسِ إِلْلا كَما أَشعَلتَ في ريحِنْ شِهابا,الوافر
231,فَيَسطَعُ تارَتَنْ حَسَننْ سَناهُ ذَكَيْيُ اللَونِ ثُمْمَ يَصيرُ هابا,الوافر
291,لَعَمرُ أَبيكَ وَالأَنباءُ تُنمى لَنِعمَ الجارُ أُختُ بَني عُوارا,الوافر
292,مِن الحَفَراتِ لَم تَفضَح أَباها وَلَم تَرفَع لِإِخَوتِها شَنارا,الوافر
293,كَأَنْنَ مَجامِعَ الأَردافِ مِنها نَق دَرَجَت عَلَيهِ الريحُ هارا,الوافر
294,يَعافُ وِصالَ ذاتِ البَذلِ قَلبي وَيَتْتَبِعُ المُمَنْنَعَةَ النوارا,الوافر
295,وَما عَجِزَت فَكيهَةُ يَومَ قامَت بِنَصلِ السَيفِ وَاِستَلَبوا الخِمارا,الوافر
296,كَأَنْنَ قَوائِمَ النَحامِ لَمْما تَحَمْمَلَ صُحبَتي أُصُلنْ مَحارُ,الوافر
297,عَلى قَرماءَ عاليَتُنْ شَواهُ كَأَنْنَ بَياضَ غُرْرَتِهِ خِمَارُ,الوافر
298,وَما يُدريكَ ما فَقري إِلَيهِ إِذا مَا القَومُ وَلْلَوا أَو أَغاروا,الوافر
299,وَيُحضِرُ فَوقَ جُهدِ الحُضرِ نَصْصنْ يَصيدُكَ قافِلنْ وَالمُخْخُ رارُ,الوافر
300,دِماءُ ثَلاثَةتِنْ أَردَت قَناتي وَخاذِفِ طَعنَةتِنْ بِقَفا يَسارِ,الوافر
301,سَمِعتُ بِجَمعِهِم فَرَضَختُ فيهِم بِنُعمانَ بنِ غَفقانَ بنِ عَمرِو,الوافر
302,فَإِن تَكفُر فَإِنْني لا أُبالي وَإِن تَشكُر فَإِنْني لَستُ أَدري,الوافر
303,كَأَنْنَ مَفالِقَ الهاماتِ مِنهُم صَراياتُنْ تَهادَتها الجَواري,الوافر
317,أَلا عَتَبَت عَلَيْيَ فَصارَمَتني وَأَعجَبَها ذَوو اللْلِمَمِ الطِوالِ,الوافر
318,فَإِنْني يا اِبنَةَ الأَقوامِ أُربي عَلى فِعلِ الوَضيْيِ مِنَ الرِجالِ,الوافر
319,فَلا تَصِلي بِصُعلوكِنْ نَؤومِنْ إِذا أَمسى يُعَدْدُ مِنَ العيَالِ,الوافر
320,وَلَكِن كُلْلُ صُعلوكِنْ ضَروبِنْ بِنَصلِ السَيفِ هاماتِ الرِجالِ,الوافر
321,أَشابَ الرَأسَ أَنْني كُلْلَ يَومِنْ أَرى لي خَالَتَنْ وَسطَ الرِجالِ,الوافر
322,يَشُقْقُ عَلَيْيَ أَن يَلقَينَ ضَيمنْ وَيَعجِزُ عَن تَخَلْلُصِهِنْنَ مالي,الوافر
342,وَكَم لاقَيتُ ذا نَجَبِنْ شَديدِنْ تَسيلُ بِهِ النُفوسُ عَلى الصُدورِ,الوافر
343,إِذا الحَربُ العَوانُ بِهِ اِستَهامَت وَجالَ فَذاكَ يَومُ قَمطَريرُ,الوافر
344,عَرَفَت مِنَ الكُنودِ بِبَطنِ ضَيمِنْ فَجَوْوِ بِشائِمِنْ طَلَلنْ مُحيلا,الوافر
345,تَعَفْفى رَسمُهُ إِلْلا خِيامنْ مَجَلْلَلَتُنْ جَوانِبُها جَليلا,الوافر
346,عَداني أَن أَزورَكَ أَنْنَ قَومي وَقَومُكَ أَلقَحوا حَربنْ شَمولا,الوافر
347,وَأَنْنَكَ لَو رَأَيتَ الناسَ يَومَ ال حِيارِ عَذَرتِ بِالشُغُلِ الخَليلا,الوافر
348,غَداةَ تَصارَخَت عَبدُ بنُ عَمرِنْو وَأَهلُ تُضاعِ فَاِحتَمَلوا قَتيلا,الوافر
349,غَداةَ حَبا لَهُم عَمرُو بنُ عَمرِنْو بِشِكْكَةِ كامِلِنْ يَدعو جَزيلا,الوافر
350,فَرَدْدوهُ بِمُشعَلَةتِنْ قَلوسُنْ تَخالُ رِداءَهُ مِنها طَميلا,الوافر
351,وَقامَ مُصَوْوِبُنْ مِنْنا وَمِنهُم وَكُلْلٌ يَتَحي حَنَقنْ وَبيلا,الوافر
352,وَقامَ مُصَوْوِتانِ بِرَأسِ عَثْثٍ أَقامَ الحَربَ وَالعَيْيَ الطَويلا,الوافر
353,وَغودِرَ في دِيارِهِم حُبَيشُنْ وَعيلَ عَلى الأَكارِسِ أَن يَؤولا,الوافر
354,وَعيلَ عَلى الحُمولِ وَمَن عَلَيها فَلا سَيرنْ يُطيقُ وَلا حُلولا,الوافر
355,وَنُسلِكُهُم مَدارِجَ بَطنِ صُرْرٍ إِلى قَرنِنْ كَما سُقتَ الحَسيلا,الوافر
356,كَأَنْنَ نِساءَهُم بَقَرُنْ مِراحُنْ خِلالَ شَقائِقِنْ تَطَأُ الوُحولا,الوافر
357,لَهُنْنَ صَواعِقُنْ يَعرِفنَ فينا بَني الأَخواتِ وَالنَسَبَ الدَخيلا,الوافر
358,بِكُلْلِ خَبيبَةتِنْ وَمَجازِ عُرضِنْ تَرى نَمَطنْ يُطَوْوَحُ أَو خَميلا,الوافر
359,فَلَمْما أَن هَبَطنا القاعَ رَدْدوا غَواشينا فَأَدبَرنا حُفولا,الوافر
360,وَقامَ لَنا بِبَطنِ القاعِ صيقُنْ فَخَلْلى الوازِعونَ لَنا السَبيلا,الوافر
361,فَأَدرَكنا دُعاهُم مِن بَعيدِنْ نَهتَزْزُ البيضَ يَشفينَ الغَليلا,الوافر
362,فَأَيْينْ ما رَأَيتَ نَظَرتَ طِرفنْ عَلَيهِ الطَيرَ مُنعَفِرنْ تَليلا,الوافر
363,فَلَمْما أَن رَأَيتُ القَومَ فَلْلوا فَلا رِندنْ قَبَضتُ وَلا فَتيلا,الوافر
364,حَبَكتُ مَلاءَتي العَلِيْيا كَأَنْني حَبَكتُ بِها قُطامِينْ هَزيلا,الوافر
365,كَأَنْنَ مِلاءَتي عَلى هِجَفْفٍ أَحَسْسَ عَشِيْيَتَنْ ريحنْ بَليلا,الوافر
366,عَلى حَثْثِ البَرايَةِ زَمخَرِيْيِ ال السَواعِدِ يَنبَري رَتَكنْ زَليلا,الوافر
367,وَأَدبَرَ عايِذُ البَقمي شَدْدنْ يَكُدْدُ الصَمدَ وَالحَزَنَ الرَحيلا,الوافر
368,وَغادَرَنا وَغادَرَ مَولِيانا بِقاعَ أَبيدَةِ الوَغمَ الطَويلا,الوافر
421,أَتُنكِرُ يا اِبنَ إِسحاقِنْ إِخائي وَتَحسَبُ ماءَ غَيري مِن إِنائي,الوافر
422,أَأَنطِقُ فيكَ هُجرنْ بَعدَ عِلمي بِأَنْنَكَ خَيرُ مَن تَحتَ السَماءِ,الوافر
423,وَأَكرَهُ مِن ذُبابِ السَيفِ طَعمنْ وَأَمضى في الأُمورِ مِنَ القَضاءِ,الوافر
424,وَما أَربَت عَلى العِشرينَ سِنْني فَكَيفَ مَلِلتُ مِن طولِ البَقاءِ,الوافر
425,وَما اِستَغرَقتُ وَصفَكَ في مَديحي فَأَنقُصَ مِنهُ شَيئنْ بِالهِجاءِ,الوافر
426,وَهَبني قُلتُ هَذا الصُبحُ لَيلُنْ أَيَعمى العالَمونَ عَنِ الضِياءِ,الوافر
427,تُطيعُ الحاسِدينَ وَأَنتَ مَرءُنْ جُعِلتُ فِدائَهُ وَهُمُ فِدائي,الوافر
428,وَهاجي نَفسِهِ مَن لَم يُمَيْيِز كَلامي مِن كَلامِهِمِ الهُراءِ,الوافر
429,وَإِنْنَ مِنَ العَجائِبِ أَن تَراني فَتَعدِلَ بي أَقَلْلَ مِنَ الهَباءِ,الوافر
430,وَتُنكِرَ مَوتَهُم وَأَنا سُهَيلُنْ طَلَعتُ بِمَوتِ أَولادِ الزِناءِ,الوافر
540,لَقَد نَسَبوا الخِيامَ إِلى عَلاءِ أَبَيتُ قَبولَهُ كُلْلَ الإِباءِ,الوافر
541,وَما سَلْلَمتُ فَوقَكَ لِلثُرَيْيا وَلا سَلْلَمتُ فَوقَكَ لِلسَماءِ,الوافر
542,وَقَد أَوحَشتَ أَرضَ الشامِ حَتْتى سَلَبتَ رُبوعَها ثَوبَ البَهاءِ,الوافر
543,تَنَفْفَسُ وَالعَواصِمُ مِنكَ عَشرُنْ فَتَعرِفُ طيبَ ذَلِكَ في الهَواءِ,الوافر
544,أَسامِرِيْيُ ضُحكَةَ كُلْلِ راءِ فَطِنتَ وَأَنتَ أَغبى الأَغبِياءِ,الوافر
545,صَغُرتَ عَنِ المَديحِ فَقُلتَ أُهجى كَأَنْنَكَ ماصَغُرتَ عَنِ الهِجاءِ,الوافر
546,وَما فَكْكَرتُ قَبلَكَ في مُحالِنْ وَلا جَرْرَبتُ سَيفي في هَباءِ,الوافر
547,لِعَيني كُلْلَ يَومِنْ مِنكَ حَظْظٌ تَحَيْيَرُ مِنهُ في أَمرِنْ عُجابِ,الوافر
548,حِمالَةُ ذا الحُسامِ عَلى حُسامِنْ وَمَوقِعُ ذا السَحابِ عَلى سَحابِ,الوافر
549,تَجِفْفُ الأَرضُ مِن هَذا الرَبابِ وَيَخلُقُ ما كَساها مِن ثِيابِ,الوافر
54,يا لَهفَ نَفسي عَلى الشَبابِ وَلَم أَفقِد بِهِ إِذ فَقَدتُهُ أَمَما,المنسرح
55,قَد كُنتُ في مَيعَةتِنْ أُسَرْرُ بِها أَمنَعُ ضَيمي وَأُهبِط العُصُما,المنسرح
56,وَأَسحَبُ الرَيطَ وَالبُرودَ إِلى أَدنى تِجاري وَأَنفُضُ اللِمَما,المنسرح
57,لا تَغبِطِ المَرءَ أَن يُقالَ لَهُ أَمسى فَلانُنْ لِعُمرِهِ حَكَما,المنسرح
58,إِن سَرْرَهُ طولُ عَيشِهِ فَلَقَد أَضحى عَلى الوَجهِ طولُ ما سَلِما,المنسرح
59,إِنْنَ مِنَ القَومِ مَن يُعاشُ بِهِ وَمِنهُمُ مَن تَرى بِهِ دَسَما,المنسرح
639,أَحسَنُ ما يُخضَبُ الحَديدُ بِهِ وَخاضِبَيهِ النَجيعُ وَالغَضَبُ,المنسرح
640,فَلا تَشينَنهُ بِالنُضارِ فَما يَجتَمِعُ الماءُ فيهِ وَالذَهَبُ,المنسرح
895,يا ذا المَعالي وَمَعدِنَ الأَدَبِ سَيْيِدَنا وَاِبنَ سَيْيِدِ العَرَبِ,المنسرح
896,أَنتَ عَلِيمُنْ بِكُلْلِ مُعجِزَةتِنْ وَلَو سَأَلنا سِواكَ لَم يُجِبِ,المنسرح
897,أَهَذِهِ قابَلَتكَ راقِصَتَنْ أَم رَفَعَت رِجلَها مِنَ التَعَبِ,المنسرح
1314,جارِيَتُنْ ما لِجِسمِها روحُ بِالقَلبِ مِن حُبْبِها تَباريحُ,المنسرح
1315,في كَفْفِها طاقَتُنْ تُشيرُ بِها لِكُلْلِ طيبِنْ مِن طيبِها ريحُ,المنسرح
1316,سَأَشرَبُ الكَأسَ عَن إِشارَتِها وَدَمعُ عَيني في الخَدْدِ مَسفوحُ,المنسرح
1327,ما سَدِكَت عِلْلَتُنْ بِمَورودِ أَكرَمَ مِن تَغلِبَ بنِ داوْوُدِ,المنسرح
1328,يَأنَفُ مِن ميتَةِ الفِراشِ وَقَد حَلْلَ بِهِ أَصدَقُ المَواعيدِ,المنسرح
1329,وَمِثلُهُ أَنكَرَ المَماتَ عَلى غَيرِ سُروجِ السَوابِحِ القودِ,المنسرح
1330,بَعدَ عِثارِ القَنا بِلَبْبَتِهِ وَصَربِهِ أَرؤُسَ الصَناديدِ,المنسرح
1331,وَخَوضِهِ غَمرَ كُلْلِ مَهلَكَةِ لِلذِمرِ فيها فُؤادُ رِعديدِ,المنسرح
1332,فَإِن صَبَرنا فَإِنْنَنا صُبُرُنْ وَإِن بَكَينا فَغَيرُ مَردودِ,المنسرح
1333,وَإِن جَزِعنا لَهُ فَلا عَجَبُنْ ذا الجَزرُ في البَحرِ غَيرُ مَعهودِ,المنسرح
1334,أَينَ الهِباتُ الْلَتي يُفَرْرِقُها عَلى الزَرافاتِ وَالمَواحيدِ,المنسرح
1335,سالِمُ أَهلِ الوِدادِ بَعدَهُمُ يَسلَمُ لِلحُزنِ لا لِتَخليدِ,المنسرح
1336,فَما تُرَجْجي النُفوسُ مِن زَمَنِنْ أَحمَدُ حالَيهِ غَيرُ مَحمودِ,المنسرح
1337,إِنْنَ نُيوبَ الزَمانِ تَعرِفُني أَنا الْلَذي طالَ عَجمُها عودي,المنسرح
1338,وَفيْيَ ما قارَعَ الخُطوبَ وَما آنَسَني بِالمَصائِبِ السودِ,المنسرح
1339,ما كُنتَ عَنهُ إِذِ اِستَغاثَكَ يا سَيفَ بَني هاشِمِنْ بِمَغمودِ,المنسرح
1340,يا أَكرَمَ الأَكرَمينَ يا مَلِكَ ال أَملاكِ طُرْرنْ يا أَصيَدَ الصيدِ,المنسرح
1341,قَد ماتَ مِن قَبلِها فَأَنشَرَهُ وَقعُ قَنا الخَطْطِ في اللَغاديدِ,المنسرح
1342,وَرَميُكَ اللَيلَ بِالجُنودِ وَقَد رَمَيتَ أَجفانَهُم بِتَسهيدِ,المنسرح
1343,فَصَبْبَحَتهُم رِعالُها شُزْزَبنْ بَينَ ثُباتِنْ إِلى عَباديدِ,المنسرح
1344,تَحمِلُ أَغمادُها الفِداءَ لَهُم فَاِنتَقَدوا الضَربَ كَالأَخاديدِ,المنسرح
1345,مَوقِعُهُ في فِراشِ هامِهِمُ وَريحُهُ في مَناخِرِ السيدِ,المنسرح
1346,أَفنى الحَياةَ الْلَتي وَهَبتَ لَهُ في شَرَفِنْ شاكِرنْ وَتَسويدِ,المنسرح
1347,سَقيمَ جِسمِنْ صَحيحَ مَكرُمَةتِنْ مَنجودَ كَربِنْ غِياثَ مَنجودِ,المنسرح
1348,ثُمْمَ غَدا قَيدُهُ الحِمامُ وَما تَخلُصُ مِنهُ يَمينُ مَصفودِ,المنسرح
1349,لا يَنقُصُ الهالِكونَ مِن عَدَدِنْ مِنهُ عَلِيْيٌ مُضَيْيَقُ البيدِ,المنسرح
1350,تَهُبْبُ في ظَهرِها كَتائِبُهُ هُبوبَ أَرواحِها المَراويدِ,المنسرح
1351,أَوْوَلُ حَرفِنْ مِنِ اِسمِهِ كَتَبَت سَنابِكُ الخَيلِ في الجَلاميدِ,المنسرح
1352,مَهما يُعَزْزُ الفَتى الأَميرَ بِهِ فَلا بِإِقدامِهِ وَلا الجودِ,المنسرح
1353,وَمِن مُنانا بَقائُهُ أَبَدنْ حَتْتى يُعَزْزى بِكُلْلِ مَولودِ,المنسرح
1442,أَهلنْ بِدارِنْ سَباكَ أَغيَدُها أَبعَدُ ما بانَ عَنكَ خُرْرَدُها,المنسرح
1443,ظَلتَ بِها تَنطَوي عَلى كَبِدِنْ نَضيجَةتِنْ فَوقَ خِلبِها يَدُها,المنسرح
1444,يا حادِيَي عيرِها وَأَحسَبُني أَوجَدُ مَيتنْ قُبَيلَ أَفقِدُها,المنسرح
1445,قِفا قَليلنْ بِها عَلَيْيَ فَلا أَقَلْلَ مِن نَظرَةتِنْ أُزَوْوِدُها,المنسرح
1446,فَفي فُؤادِ المُحِبْبِ نارُ جَو أَحَرْرُ نارِ الجَحيمِ أَبرَدُها,المنسرح
1447,شابَ مِنَ الهَجرِ فَرقُ لِمْمَتِهِ فَصارَ مِثلَ الدِمَقسِ أَسوَدُها,المنسرح
1448,بانو بِخُرعوبَةتِنْ لَها كَفَلُنْ يَكادُ عِندَ القِيامِ يُقعِدُها,المنسرح
1449,رِبَحلَةتِنْ أَسمَرِنْ مُقَبْبَلُها سِبَحلَةتِنْ أَبيَضِنْ مُجَرْرَدُها,المنسرح
1450,يا عاذِلَ العاشِقينَ دَع فِئَتَنْ أَضَلْلَها اللَهُ كَيفُ تُرشِدُها,المنسرح
1451,لَيسَ يُحيكُ المَلامُ في هِمَمِنْ أَقرَبُها مِنكَ عَنكَ أَبعَدُها,المنسرح
1452,بِئسَ اللَيالي سَهِرتُ مِن طَرَبي شَوقنْ إِلى مَن يَبيتُ يَرقُدُها,المنسرح
1453,أَحيَيتُها وَالدُموعُ تُنجِدُني شُؤونَها وَالظَلامُ يُنجِدُها,المنسرح
1454,لا ناقَتي تَقبَلُ الرَديفَ وَلا بِالسَوطِ يَومَ الرِهانِ أُجهِدُها,المنسرح
1455,شِراكُها كورُها وَمِشفَرُها زِمامُها وَالشُسوعُ مِقوَدُها,المنسرح
1456,أَشَدْدُ عَصفِ الرِياحِ يَسبِقُهُ تَحتِيَ مِن خَطوِها تَأَيْيُدُها,المنسرح
1457,في مِثلَ ظَهرِ المِجَنْنِ مُتْتَصِلِنْ بِمِثلِ بَطنِ المِجَنْنِ قَردَدُها,المنسرح
1458,مُرتَمِياتُنْ بِنا إِلى اِبنِ عُبَي دِ اللَهِ غيطانُها وَفَدفَدُها,المنسرح
1459,إِلى فَت يُصدِرُ الرِماحَ وَقَد أَنهَلَها في القُلوبِ مَورِدُها,المنسرح
1460,لَهُ أَيادِنْ إِلَيْيَ سابِقَتُنْ أُعَدْدُ مِنها وَلا أُعَدْدِدُها,المنسرح
1461,يُعطي فَلا مَطلَتُنْ يُكَدْدِرُها بِها وَلا مَنْنَتَنْ يُنَكْكِدُها,المنسرح
1462,خَيرُ قُرَيشِنْ أَبنْ وَأَمجَدُها أَكثَرُها نائِلنْ وَأَجوَدُها,المنسرح
1463,أَطعَنُها بِالقَناةِ أَصرَبُها بِالسَيفِ جَحجاحُها مُسَوْوَدُها,المنسرح
1464,أَفرَسُها فارِسنْ وَأَطوَلُها باعنْ وَمِغوارُها وَسَيْيِدُها,المنسرح
1465,تاجُ لُؤَيْيِ بنِ غالِبِنْ وَبِهِ سَما لَها فَرعُها وَمَحتِدُها,المنسرح
1466,شَمسُ ضُحاها هِلالُ لَيلَتِها دُرْرُ تَقاصيرِها زَبَرجَدُها,المنسرح
1467,يا لَيتَ بي ضَربَتَنْ أُتيحَ لَها كَما أُتيحَت لَهُ مُحَمْمَدُها,المنسرح
1468,أَثْثَرَ فيها وَفي الحَديدِ وَما أَثْثَرَ في وَجهِهِ مُهَنْنَدُها,المنسرح
1469,فَاِغتَبَطَت إِذ رَأَت تَزَيْيُنَها بِمِثلِهِ وَالجِراحُ تَحسُدُها,المنسرح
1470,وَأَيقَنَ الناسُ أَنْنَ زارِعَها بِالمَكرِ في قَلبِهِ سَيَحصِدُها,المنسرح
1471,أَصبَحَ حُسْسادُهُ وَأَنفُسُهُم يُحدِرُها خَوفُهُ وَيُصعِدُها,المنسرح
1472,تَبكي عَلى الأَنصُلِ الغُمودِ إِذا أَنذَرَها أَنْنَهُ يُجَرْرِدُها,المنسرح
1473,لِعِلمِها أَنْنَها تَصيرُ دَمنْ وَأَنْنَهُ في الرِقابِ يُغمِدُها,المنسرح
1474,أَطلَقَها فَالعَدُوْوُ مِن جَزَعِنْ يَذُمْمُها وَالصَديقُ يَحمَدُها,المنسرح
1475,تَنقَدِحُ النارُ مِن مَضارِبِها وَصَبْبُ ماءِ الرِقابِ يُخمِدُها,المنسرح
1476,إِذا أَضَلْلَ الهُمامُ مُهجَتَهُ يَومنْ فَأَطرافُهُنْنَ تَنشُدُها,المنسرح
1477,قَد أَجمَعَت هَذِهِ الخَليقَةُ لي أَنْنَكَ يا اِبنَ النَبِيْيِ أَوحَدُها,المنسرح
1478,وَأَنكَ بِالأَمسِ كُنتَ مُحتَلِمنْ شَيخَ مَعَدْدٍ وَأَنتَ أَمرَدُها,المنسرح
1479,فَكَم وَكَم نِعمَةتِنْ مُجَلْلِلَةتِنْ رَبْبَيتَها كانَ مِنكَ مَولِدُها,المنسرح
1480,وَكَم وَكَم حاجَةتِنْ سَمَحتَ بِها أَقرَبُ مِنْني إِلَيْيَ مَوعِدُها,المنسرح
